,id_str,score_keyword,score_textblob_bayes_sentiment,score_textblob_pattern_sentiment,text,score,anger,negative
206,928124338343202816,0.0,0.37,0.17390354640884234,Leaving South Korea now heading to China. Looking very much forward to meeting and being with President Xi!,0.09065059106814038,0.0,0.0
207,929492850101940225,0.0,0.5,0.040093760395348066,"Will be doing a joint press conference in Hanoi, Vietnam then heading for final destination of trip, the Phillipines.",0.09001562673255802,0.0,0.0
208,928016742575738882,0.0,0.5,0.03932148945248469,Thank you to all Americans who participated in Nat'l Rx Drug Take Back Day. A record amount of drugs collected &amp; disposed. We can do this!,0.08988691490874745,0.0,0.0
239,923150966551171073,0.0,0.39916666666666667,0.03493268993090415,"Working hard on the biggest tax cut in U.S. history. Great support from so many sides. Big winners will be the middle class, business &amp; JOBS",0.08971100387737292,0.0,0.10416666666666667
215,925913030159937537,0.0,0.3055555555555556,0.207310327433058,It is finally happening for our great clean coal miners! https://t.co/suAnjs6Ccz,0.08547764716476892,0.0,0.0
216,931123400810037248,0.0,0.385,0.12763003557698133,"....your release possible and, HAVE A GREAT LIFE! Be careful, there are many pitfalls on the long and winding road of life!",0.08543833926283022,0.0,0.0
217,925688931823300609,0.0,0.5,0.00718651765511589,"""Senator Chuck Schumer helping to import Europes problems"" said Col.Tony Shaffer. We will stop this craziness!  @foxandfriends",0.08453108627585265,0.0,0.0
219,928931835664465921,0.0,0.5,0.0046353768996002685,The United States is prepared to work with each of the leaders in this room today to achieve mutually beneficial co… https://t.co/6hY41gFM5i,0.08410589614993337,0.0,0.0
220,927672843504177152,0.0,0.2375,0.2662663941915392,"I have great confidence in King Salman and the Crown Prince of Saudi Arabia, they know exactly what they are doing....",0.08396106569858985,0.0,0.0
223,926185468911382529,0.0,0.5,0.002254570730916071,"Broadcom's move to America=$20 BILLION of annual rev into U.S.A., $3+ BILLION/yr. in research/engineering &amp; $6 BILL… https://t.co/0PUrl6k86K",0.08370909512181934,0.0,0.0
282,925845770724618240,0.0,0.25,0.0007062293872642198,@SenateMajLdr @SenateGOP ...and Appeals Court Judges at a record clip! Our courts are rapidly changing for the better!,0.08146691124708372,0.23809523809523808,0.0
225,925860866767163393,0.0,0.4,0.08809365041778035,"CHAIN MIGRATION must end now! Some people come in, and they bring their whole family with them, who can be truly ev… https://t.co/g0RgPIG2K3",0.08134894173629673,0.0,0.0
227,933921775984967681,0.0,0.09999999999999998,0.3772478135676308,Two great people! https://t.co/5cVnMhnmuH,0.0795413022612718,0.0,0.0
267,930301344342265857,0.0,0.3,0.031892797230410365,Great to see @RandPaul looking well and back on the Senate floor. He will help us with TAX CUTS and REFORM!,0.07947005557704907,0.0,0.14492753623188406
229,923320000185847808,0.0,0.3,0.1693930257945717,Interview with @LouDobbs coming up at 7pmE on @FoxBusiness. Enjoy! https://t.co/9V9z015kVl,0.07823217096576195,0.0,0.0
230,923876612013248512,0.0,0.3833333333333333,0.08422995519411809,JFK Files are being carefully released. In the end there will be great transparency. It is my hope to get just about everything to public!,0.07792721475457523,0.0,0.0
233,925534445393928199,0.0,0.4513888888888889,0.005989862897055747,"I have just ordered Homeland Security to step up our already Extreme Vetting Program. Being politically correct is fine, but not for this!",0.0762297919643241,0.0,0.0
235,922067676708638721,0.0,0.3,0.15361168810609985,Doing interview today with Maria Bartiromo at 10:00 A.M. on @FoxNews - ENJOY!,0.07560194801768332,0.0,0.0
236,930050967067820032,0.0,0.375,0.07786747546674436,Will be leaving the Philippines tomorrow after many days of constant mtgs &amp; work in order to #MAGA! My promises are rapidly being fulfilled.,0.07547791257779073,0.0,0.0
265,922428118685581313,0.0,0.2666666666666667,0.07833943884019348,"There will be NO change to your 401(k). This has always been a great and popular middle class tax break that works, and it stays!",0.07542216453788171,0.0,0.10752688172043011
238,930747213659197441,0.0,0.2625,0.18072598261219866,".@foxandfriends will be showing much of our successful trip to Asia, and the friendships &amp; benefits that will endure for years to come!",0.07387099710203311,0.0,0.0
240,925925920304779264,0.0,0.3647727272727273,0.06906403056836627,"Great mtg w/ @Cabinet today. Tomorrow, I will be announcing the new head of the Fed. I think you will be extremely… https://t.co/dKtJBjGlYe",0.07230612630684892,0.0,0.0
241,929492038231429120,0.0,0.4,0.03256761993607889,President Xi of China has stated that he is upping the sanctions against #NoKo. Said he wants them to denuclearize. Progress is being made.,0.07209460332267982,0.0,0.0
286,922440008971292672,0.0,0.175,0.0003826745909285853,"I had a very respectful conversation with the widow of Sgt. La David Johnson, and spoke his name from beginning, without hesitation!",0.0719654885001975,0.0,0.25641025641025644
242,923866849451888640,0.0,0.09999999999999998,0.33001794515113864,Thank you @foxandfriends. Really great job and show!,0.07166965752518976,0.0,0.0
244,924966722544848896,0.0,0.09999999999999998,0.32624397670117666,Great job by MichaelCaputo on @foxandfriends.,0.07104066278352944,0.0,0.0
276,923268967728386049,0.0,0.2866666666666667,0.001001168215263578,"Spoke to President Xi of China to congratulate him on his extraordinary elevation. Also discussed NoKo &amp; trade, two very important subjects!",0.07016686136921059,0.0,0.13333333333333333
246,933917415028772864,0.0,0.35,0.06738403929009304,"RT @Scavino45: Today, @POTUS @realDonaldTrump and @FLOTUS Melania visit the @USCG at the Lake Worth Inlet Station, in Riviera Beach, Florid…",0.06956400654834884,0.0,0.0
247,933918671503753216,0.0,0.09999999999999998,0.3082405923521617,A great guy (with great ratings)! https://t.co/S0S6xqrjSC,0.06804009872536028,0.0,0.0
250,926793510723796993,0.0,0.3672727272727273,0.029593538543932582,Would very much appreciate Saudi Arabia doing their IPO of Aramco with the New York Stock Exchange. Important to the United States!,0.06614437763610999,0.0,0.0
251,930742717721739264,0.0,0.3875,0.008870968390350644,"RT @PChowka: Sean Hannity's Big Week - Top Ratings, Probing Reporting, and Let There Be Light at American Thinker https://t.co/b0RxpZd3Lb h…",0.06606182806505843,0.0,0.0
252,933105158275325952,0.0,0.3579545454545455,0.032942725326793765,"Today, we continued a wonderful American Tradition at the White House. Drumstick and Wishbone will live out their d… https://t.co/kATC8YVCyz",0.06514954513022321,0.0,0.0
255,926155393490878464,0.0,0.3125,0.06301795519808427,I am calling on Congress to TERMINATE the diversity visa lottery program that presents significant vulnerabilities… https://t.co/GcHKCxTNyF,0.06258632586634738,0.0,0.0
256,930305984077156352,0.0,0.325,0.0504185235478872,"Just arrived at #ASEAN50 in the Philippines for my final stop with World Leaders. Will lead to FAIR TRADE DEALS, un… https://t.co/ExRBdQnJru",0.06256975392464786,0.0,0.0
257,934507210385829888,0.0,0.2333333333333333,0.13279779748826756,"Happy #SmallBusinessSaturday!

A great day to support your community and America’s JOB creators by shopping locally… https://t.co/a0fME8HRXT",0.06102185513693348,0.0,0.0
259,928969836897583104,0.0,0.3,0.06339903692872775,"On behalf of an entire nation, Happy 242nd Birthday to the men and women of the United States Marines!
#USMC242… https://t.co/EDmzIuB09r",0.06056650615478796,0.0,0.0
260,929320777668628480,0.0,0.2625,0.0979485284405912,"On this wonderful Veterans Day, I want to express the incredible gratitude of the entire American Nation to our GRE… https://t.co/MhHOaVTAWC",0.06007475474009854,0.0,0.0
263,923212567232774145,0.0,0.09999999999999998,0.2559269337862844,MAKE AMERICA GREAT AGAIN! https://t.co/CbEwJSQ1A3,0.059321155631047395,0.0,0.0
261,933659179348299776,0.0,0.09999999999999998,0.2559269337862844,@ThePlumLineGS MAKE AMERICA GREAT AGAIN!,0.059321155631047395,0.0,0.0
262,933662564587855877,0.0,0.09999999999999998,0.2559269337862844,MAKE AMERICA GREAT AGAIN!,0.059321155631047395,0.0,0.0
264,927645648685551616,0.0,0.35,0.0013651268557755573,"My visit to Japan and friendship with PM Abe will yield many benefits, for our great Country. Massive military &amp; energy orders happening+++!",0.05856085447596259,0.0,0.0
266,928922787938385920,0.0,0.3125,0.02925189488583757,"In more and more places throughout this region, citizens of SOVEREIGN and INDEPENDENT nations have taken greater co… https://t.co/RoZxYEdh9m",0.056958649147639595,0.0,0.0
268,930362633852735488,0.0,0.2,0.1199629649740293,THANK YOU to the amazing staff and their families of the United States Embassy in the Philippines. Keep up the GREA… https://t.co/qL8BBq3GOs,0.053327160829004884,0.0,0.0
269,927844454957850625,0.0,0.07500000000000001,0.241592600712554,Thank you to President Moon of South Korea for the beautiful welcoming ceremony. It will always be remembered. https://t.co/bMvJz1iV2a,0.052765433452092336,0.0,0.0
270,926216279287042048,0.0,0.3,0.014206092286806018,"Today, it was my pleasure and great honor to announce my nomination of Jerome Powell to be the next Chairman of the… https://t.co/32kLFYbbuq",0.052367682047801005,0.0,0.0
271,930744931609694208,0.0,0.25,0.04891910837451716,Our great country is respected again in Asia. You will see the fruits of our long but successful trip for many years to come!,0.049819851395752866,0.0,0.0
272,925916863401480192,0.0,0.09999999999999998,0.19256536000960245,"Happy birthday to @garyplayer, a truly great Champion and Person!",0.04876089333493374,0.0,0.0
273,926157911151214592,0.0,0.25,0.0422891116130201,Congress must end chain migration so that we can have a system that is SECURITY BASED! We need to make AMERICA SAFE… https://t.co/nxEDGfXlV9,0.048714851935503345,0.0,0.0
274,927077305876434945,0.0,0.21666666666666667,0.07250356596099497,Heading into the 12 days with great negotiating strength because of our tremendous economy. https://t.co/4HnXkR3EhW,0.048195038771276934,0.0,0.0
275,923392161634275328,0.0,0.09999999999999998,0.18821764688855253,"Together, we will Make America Great Again!
#AmericaFirst🇺🇸 https://t.co/ajiC3flNkI",0.04803627448142542,0.0,0.0
278,930049882949345281,0.0,0.09999999999999998,0.16207962389643432,"Great day of bilateral meetings at #ASEANSummit on trade, which we are turning around to be great deals for our cou… https://t.co/n7g7Zvo9pl",0.043679937316072386,0.0,0.0
279,928918183104225280,0.0,0.15000000000000002,0.10923439321755388,"Throughout my travels, I've had the pleasure of sharing the good news from America. I've had the honor of sharing o… https://t.co/eGkJAZaPuU",0.04320573220292565,0.0,0.0
280,923894747793580033,0.0,0.175,0.0795255726747791,Happy birthday to the great @TheLeeGreenwood. You and your beautiful song have made such a difference. MAKE AMERICA GREAT AGAIN!,0.04242092877912985,0.0,0.0
281,930657178544984066,0.0,0.05624999999999997,0.19619678481773947,Just returned from Asia after 12 very successful days. Great to be home!,0.0420744641362899,0.0,0.0
283,926647019455766528,0.0,0.19375,0.03932799987676994,Thank you for such a beautiful welcome Hawaii. My great honor to visit @PacificCommand upon arrival. Heading to Pea… https://t.co/Yr6OZitxGR,0.03884633331279499,0.0,0.0
284,928519663780208640,0.0,0.18,0.0252606732212434,"President Xi, thank you for such an incredible welcome ceremony. It was a truly memorable and impressive display! 📸… https://t.co/Jbj5TWhCla",0.03421011220354057,0.0,0.0
285,933831194558582784,0.0,0.16666666666666669,0.02635933551098537,"My great honor to join our incredible men and women of the @USCG, at the Lake Worth Inlet Station, in Riviera Beach… https://t.co/x3XZJA9DiF",0.03217100036294201,0.0,0.0
287,926176823117074433,0.0,0.15000000000000002,0.020277927864273543,"Today, we are thrilled to welcome @Broadcom CEO Hock Tan to the WH to announce he is moving their HQ’s from Singapo… https://t.co/iSUzEbrn0c",0.028379654644045595,0.0,0.0
288,929503641014112256,0.0,0.15000000000000002,0.019514571360267064,"When will all the haters and fools out there realize that having a good relationship with Russia is a good thing, n… https://t.co/tPCd8nSwY3",0.028252428560044517,0.0,0.0
289,929503025512693760,0.0,0.15000000000000002,0.0013305830102832972,Met with President Putin of Russia who was at #APEC meetings. Good discussions on Syria. Hope for his help to solve… https://t.co/eOt8rDcpeY,0.02522176383504722,0.0,0.0
290,928267692645036032,0.0,0.09999999999999998,0.025465672620455057,"On behalf of @FLOTUS Melania and I, THANK YOU for an unforgettable afternoon and evening at the Forbidden City in B… https://t.co/Q9H0MPdIvU",0.020910945436742507,0.0,0.0
291,929655283181391874,0.0,0.09999999999999998,0.019059677441784426,"Just landed in the Philippines after a great day of meetings and events in Hanoi, Vietnam! https://t.co/YxHRNhhPWo",0.019843279573630735,0.0,0.0
292,927397233741492225,0.0,0.0,0.10516891782473754,...Americans do what we do best: we pull together. We join hands. We lock arms and through the tears and the sadnes… https://t.co/CTtTeWjVHX,0.01752815297078959,0.0,0.0
293,929670192434745344,0.0,0.0,0.031964016426059595,"We had a wonderful visit to Vietnam, thank you President Tran Dai Quang! Heading to the #ASEANSummit 50th Anniv Gal… https://t.co/s5gIKMqt50",0.0053273360710099325,0.0,0.0
